Front,Back,Context
What is the main finding of Kukushkin et al. (2024) regarding the massed-spaced learning effect in non-neural systems?,"The researchers found that the massed-spaced learning effect, previously thought to require neural mechanisms, can emerge in non-neural human cell cultures through simple molecular mechanisms involving receptor dynamics.","The paper demonstrates that human cells in culture (HEK293 and HeLa cells) show improved responses to repeated stimuli when those stimuli are presented with spacing between them rather than all at once (massed). This finding suggests that the cellular foundations of learning phenomena traditionally attributed to neural systems may be more fundamentally rooted in basic molecular mechanisms present in all cells."
What experimental model did Kukushkin et al. use to study learning effects in non-neural systems?,"The researchers used human embryonic kidney (HEK293) cells and HeLa cells in culture, with calcium imaging to measure cellular responses to repeated chemical stimuli.","The researchers chose non-neural cell types that nonetheless possess the relevant calcium signaling machinery and G-protein-coupled receptors (GPCRs) needed to respond to chemical stimuli. They used real-time calcium imaging with fluorescent calcium indicators to visualize and quantify how cells responded to repeated stimulations with substances like carbachol and histamine. This model allowed them to precisely control stimulus timing and measure response dynamics in individual cells."
How did the researchers define and measure the spaced learning advantage in cellular responses?,"They measured the spaced learning advantage as the ratio of cellular calcium responses to spaced stimuli versus massed stimuli, with a ratio greater than 1 indicating a spacing advantage.","The researchers applied a 'massed' protocol (stimuli delivered with minimal or no interval) and a 'spaced' protocol (stimuli separated by defined recovery intervals) to the same cell populations. They quantified cellular responses by measuring intracellular calcium concentration changes using fluorescent indicators. The response amplitudes were compared between protocols, with the ratio of spaced to massed responses defining the spacing advantage. A ratio above 1.0 indicated better responses to spaced stimuli."
What mechanism did the study identify as responsible for the massed-spaced effect at the cellular level?,"The effect emerges from the dynamics of receptor desensitization and resensitization: receptors become temporarily unresponsive after stimulation and require time to recover, making spaced presentations more effective.","The paper identifies receptor dynamics as the key mechanism. G-protein-coupled receptors (GPCRs) become desensitized following activation, as they are phosphorylated and internalized. This makes them temporarily unresponsive to further stimulation. With time, receptors are dephosphorylated and recycled back to the cell membrane (resensitization). When stimuli are massed together, many receptors remain in a desensitized state, resulting in diminished responses. When stimuli are spaced, receptors have time to resensitize between stimulations, leading to stronger responses."
How does the timescale of the massed-spaced effect in cellular systems compare to that in behavioral memory?,"The cellular spacing effect occurs on a timescale of minutes, which is much shorter than the hours to days typically observed in behavioral memory experiments, suggesting multiple time-dependent processes may contribute to behavioral spacing effects.","The study found that optimal spacing intervals for cellular responses were around 5-10 minutes, with the effect diminishing at much longer intervals (30+ minutes). This is considerably shorter than the optimal spacing intervals for behavioral memory, which can be hours or days. This discrepancy suggests that while receptor dynamics may contribute to the spacing effect in behavior, additional slower processes (such as gene expression, protein synthesis, or neural network dynamics) likely amplify and extend the timescale of the spacing effect in complete organisms."
What was the effect of varying the number of stimulations on the spaced learning advantage?,"The spacing advantage increased with the number of stimulations, with little difference after 2 stimuli but significant advantages emerging after 4 or more stimulations.","The researchers tested how the spacing advantage changed when varying the number of consecutive stimulations (from 2 to 10). They found that the spacing advantage was minimal with just 2 stimulations but became progressively larger as the number of stimulations increased. This suggests that the cumulative effects of receptor desensitization are particularly important during extended training protocols, which aligns with observations from behavioral studies where spacing effects are more pronounced with more learning trials."
How did the researchers mathematically model the massed-spaced effect?,"They developed a mathematical model based on receptor kinetics where receptors transition between responsive, desensitized, and internalized states, successfully predicting how various protocols affect cellular responses.","The researchers created a computational model incorporating key aspects of GPCR dynamics: activation, desensitization (where receptors become temporarily unresponsive), internalization (where receptors are removed from the cell surface), and resensitization (where receptors return to a responsive state). This model successfully reproduced the experimental observations and allowed predictions about how specific manipulations would affect the spacing advantage. The modeling suggested that the interplay between these receptor state transitions is sufficient to generate the observed spacing effects."
What effect did blocking receptor internalization have on the spaced learning advantage?,"Blocking receptor internalization with pharmacological inhibitors or genetic modifications reduced or eliminated the spacing advantage, confirming the role of receptor dynamics in generating this effect.","The researchers used multiple approaches to interfere with receptor internalization, including dynamin inhibitors (which block endocytosis) and dominant-negative mutants of arrestin and dynamin (proteins involved in receptor internalization). These interventions prevented receptors from being removed from the cell surface after activation. In all cases, blocking internalization significantly reduced or eliminated the spacing advantage, as predicted by their mathematical model. This provided strong evidence that receptor trafficking dynamics are causally involved in generating the spacing effect."
What is the significance of finding the massed-spaced effect in non-neural cells?,"It suggests that the spacing effect in learning and memory may have evolved from fundamental cellular processes present in all cells, with neural systems later building upon and extending these basic mechanisms.","The findings challenge the traditional view that learning phenomena like the spacing effect are uniquely neural properties. Instead, they suggest that basic cellular processes may have provided the evolutionary foundation upon which more complex learning systems were built. The authors propose that neural systems might have co-opted and elaborated upon these fundamental cellular mechanisms, adding additional layers of complexity while retaining the core advantages of spaced information processing."
How did different cell types respond to the spaced versus massed stimulation protocols?,"Both HEK293 and HeLa cells showed the spacing advantage, but with different preferred intervals and magnitudes, suggesting the effect is general but tuned to specific cell types' receptor dynamics.","The study tested multiple cell types and found the spacing effect present in both, but with quantitative differences. HEK293 cells showed optimal spacing intervals around 5-10 minutes, while HeLa cells had slightly different optimal timing. The magnitude of the spacing advantage also varied between cell types. These differences likely reflect variations in the expression levels of receptors and in the kinetics of receptor processing machinery across cell types, suggesting that while the mechanism is general, its parameters are cell-type specific."
What happens to cellular responses when the spacing interval becomes too long?,"When spacing intervals become too long (exceeding 30 minutes in this study), the spacing advantage diminishes or disappears as receptors fully recover between stimulations.","The researchers systematically varied the inter-stimulus interval and found that very long intervals eventually lead to a decrease in the spacing advantage. This occurs because with sufficiently long intervals, receptors completely resensitize between stimulations, making the response to each stimulus essentially independent of previous stimulations. This creates an inverted U-shaped relationship between interval length and spacing advantage, with both very short intervals (massed) and very long intervals showing reduced benefits compared to optimal intermediate spacing."
How does the cellular massed-spaced effect relate to the phenomenon of tolerance in pharmacology?,"The cellular mechanism identified (receptor desensitization and resensitization) is the same process that underlies drug tolerance, where repeated or continuous drug exposure leads to diminished responses.","The paper draws parallels between their findings and the phenomenon of drug tolerance in pharmacology. Both involve similar receptor dynamics: when receptors are continuously or repeatedly activated by drugs, they become desensitized, leading to diminished responses (tolerance). The spacing effect can be seen as the flip side of tolerance—by appropriately timing stimulations to allow receptor recovery, the detrimental effects of desensitization can be minimized. This connection suggests that insights about optimal dosing schedules in pharmacology might inform educational strategies, and vice versa."
What role does calcium signaling play in the cellular spaced learning effect?,"Calcium serves as both the measured response and a potential mechanism in the effect, as calcium-dependent enzymes regulate receptor desensitization, potentially creating feedback loops that enhance the spacing effect.","The study used calcium signals as their primary readout of cellular responses, but calcium itself may play a mechanistic role in the spacing effect. Many of the kinases that phosphorylate GPCRs (leading to desensitization) are calcium-dependent, creating potential feedback loops. When a stimulus causes calcium influx, it may accelerate receptor desensitization, further amplifying the benefits of spacing. The researchers note this as a potential additional mechanism that could enhance the basic receptor trafficking dynamics they focused on."
How might the finding of cellular spacing effects influence educational practices?,"The findings suggest that spacing effects are fundamental cellular phenomena, which reinforces the importance of distributed practice in education while providing a deeper biological understanding of why this works.","While the paper primarily focuses on cellular mechanisms, the authors discuss implications for education and learning. They suggest that the ubiquity of spacing effects across biological scales—from individual cells to complex behaviors—underscores how fundamentally advantageous spaced information processing is. This provides additional biological justification for educational practices that incorporate distributed practice rather than cramming. However, they note that the different timescales of cellular versus behavioral spacing effects indicate that additional mechanisms beyond receptor dynamics contribute to behavioral learning."
What future research directions did the authors suggest based on their findings?,"They proposed investigating how spacing effects at the cellular level might interact with neural network dynamics, exploring cellular spacing effects in actual neurons, and examining how these basic mechanisms might contribute to behavioral learning across different timescales.","The paper outlines several promising directions for future research. These include: 1) Studying how the cellular spacing effect manifests in actual neurons, which might have specialized mechanisms that enhance the basic effect; 2) Investigating how cellular-level spacing effects might be amplified or modified by neural network dynamics; 3) Exploring how these rapid cellular processes might interact with slower mechanisms like gene expression to generate the longer-timescale spacing effects seen in behavior; 4) Developing more sophisticated mathematical models that integrate cellular and network-level processes across multiple timescales."